{
  "columns": {
    "amount": {
      "scale": 2,
      "type": "decimal"
    },
    "region": {
      "normalize": [
        "trim",
        "casefold"
      ],
      "type": "string"
    }
  },
  "comparison_mode": "aggregate",
  "delimiters": {
    "baseline": ",",
    "candidate": ","
  },
  "group_by": [
    "region"
  ],
  "measures": {
    "revenue": {
      "column": "amount",
      "comparison": "numeric",
      "nulls": "reject",
      "operator": "sum",
      "tolerance": {
        "absolute": "0.01",
        "formula": "symmetric-v1",
        "relative": "0"
      }
    },
    "rows": {
      "operator": "count"
    }
  },
  "null_tokens": {
    "baseline": [],
    "candidate": []
  },
  "output": {
    "sensitivity": "summary"
  },
  "recipe_version": 2,
  "scope": {
    "completeness": "full",
    "cutoff": "2026-10-09T00:00:00Z",
    "expected_empty": false,
    "filters": [],
    "snapshot": "synthetic-regional-revenue-v1"
  }
}
